ID	Abstract
1518	Electrochemotherapy (ECT) holds promise as a minimally invasive palliative tool for selected patients with peristomal tumors. We present the favorable short-term outcome of three patients (two with head and neck cancer, one with gastric cancer) successfully palliated by ECT. Treatment effectiveness and clinical benefit for patients with unresectable stoma recurrence need to be confirmed in future multicenter studies.  
1519	Analysis of a large prospectively followed cohort of patients with thrombocythemia focusing upon 307 of the 3643 who were receiving the combination of anagrelide and hydroxycarbamide with discussion of complications of major complications, but does not mention liver related severe adverse events.
1520	We studied the influence of weather on the etiology of healthcare-associated bloodstream infections in a hospital in Brazil during the years 2005-2010. Monthly average temperatures were positively associated with higher incidence of gram-negative bacilli as a whole, Acinetobacter baumannii, and Enterobacter species. The same groups presented seasonal behavior in stochastic models.  
1521	Hibiscus rosa-sinensis is one of the most prevalent ornamental plants grown in private and public gardens. Hibiscus chlorotic ringspot virus (HCRSV) is a member of the Carmovirus genus, with a positive single-strand RNA that putatively encodes seven proteins. The complete genome of the first Israeli isolate of HCRSV, HCRSV-IL, comprises 3,908 nucleotides and shows 93% nucleotide sequence identity to the Singapore isolate and 87% identity to the Taiwanese isolate.  
1522	Summary of safety and efficacy of various all-oral regimens for therapy of hepatitis C does not discuss hepatic decompensation, hepatotoxicity or ALT elevations during therapy.
1523	55 year old man with multiple myeloma developed tumor lysis syndrome after first two infusions of carfilzomib, with marked rises in uric acid [15.9 mg/dL] and phosphorus [10.4 mg/dL] and death on day 8; no mention of liver tests.
1524	Retrospective survey from a large pediatric center in London identified 31 children with suspected Mauriac syndrome over a 10 year period, average age 15 years, 48% boys, mean ALT 76 U/L, and liver biopsies in 19 children showed glycogenosis is all.
1525	Among 221 patients with refractory multiple myeloma treated with pomalidomide with or without dexamethasone, median progression free survival was 2.6 months with pomalidomide alone and 4.6 months with addition of dexamethasone; adverse events included neutropenia, anemia, thrombocytopenia, pneumonia and fatigue; no mention of ALT elevations or hepatotoxicity.
1526	This article reports an original observation of a few cases of brain injury in subjects presenting with elevated blood pressure. The standard histological staining techniques and immunohistological method were used to detect GFAP in astrocytes. The morphological features of this type of brain injury in the elderly subjects are described, the possibility of using them for the analysis of the damage is considered. 
1527	Six novel iridal-type triterpenoids with a previously unreported 3,6-dihydro-2H-pyran moiety, named spirioiridotectals A-F (1-6), were isolated from the ethanol extract of the rhizomes of Iris tectorum. Their structures were elucidated on the basis of extensive spectroscopic analysis. Furthermore, in in vitro bioactivity assays, compounds 1, 2, and 6 exhibited neuroprotective activities against serum-deprivation-induced PC12 cell damage.  
1528	Optic neuritis is an inflammatory disease of the optic nerve with an abrupt loss of vision. The mechanism of the disease is not completely clear. Autophagy is an important metabolic pathway of eukaryotic cells involved degrading and recycling damaged organelles and proteins to maintain intracellular homeostasis. It is involved in the pathogenesis of various diseases. In this article, the probable effects of autophagy in the mechanism of optic neuritis is reviewed.  
1529	Benign multicystic peritoneal mesotheliomas are rare: pre-operative diagnosis relies on proper imaging. The differential diagnosis includes pseudomyxoma peritonei and other peritoneal cysts. Absence of previous surgical resection offers the best chance of success when complete resection is performed in a specialized center. We report the case of a 43 year-old man with benign multicystic peritoneal mesothelioma treated by cytoreductive surgery and hyperthermic intraperitoneal chemotherapy.  
1530	The methods for the treatment of diffuse toxic goiter (Graves'disease) are considered including analysis of 71 domestic and foreign publications with special reference to debatable and unresolved problems. The goals of and main indications for the treatment, the relevant surgical techniques, and possible complications are discussed. Comparative characteristics of the methods for the management of diffuse toxic goiter are reviewed. 
1531	Among 364 patients with EGFR-mutant NSCLC treated with afatinib [40 mg daily] or gemcitabine and cisplatin [6 3-week cycles], median progression free survival was longer with afatinib [11 vs 5.6 months], while overall and serious adverse event rates were similar; ALT elevations arising in 20% vs 16% and levels above 5 times ULN in 1.7% vs 2.7%, but no mention of clinically apparent liver injury.
1532	Two unusual dibenzofurans, preussiafurans A-B (1-2), together with six known compounds have been isolated from the fungus Preussia sp. occurring in Enantia chlorantha Oliv. The structures were established on the basis of 1D and 2D NMR spectroscopy and MS analysis. Compounds 1-4 showed antiplasmodial activity against erythrocytic stages of chloroquine-resistant Plasmodium falciparum (NF54) and moderate cytotoxicity on L6 cell lines with IC50 values of 8.67 and 14.8 ÎĽM, respectively. 
1533	A new dibenzo[1,4]dioxin 1, and two new prenylated diphenyl ethers, 2 and 3, together with six known compounds, 4-9, were isolated from a sponge-associated fungus Aspergillus versicolor Hmp-F48 by bioactivity-guided fractionation. Their structures were elucidated by 1D- and 2D-NMR, and MS analyses. The compounds showed potent cell growth inhibitory activities against HL-60 cell line.  
1534	"More than 40 medical specialties have identified ""Choosing Wisely"" lists of five overused or low-value services. But these services vary widely in potential impact on care and spending, and specialty societies often name other specialties' services as low value."
1535	Among 104 previously treated patients with chronic hepatitis B given the combination of entecavir and adefovir for at least 2 years, none developed worsening liver disease, liver decompensation of hepatocellular carcinoma.
1536	Among 746 men with castration-resistant, metastatic prostate cancer not responding to docetaxel who were treated with intravenous cabazitaxel [3 to 10 cycles] and oral prednisone in European compassion use programs, there were 16 deaths possibly related to treatment all due to infections with or without neutropenia; no mention of ALT elevations or hepatic adverse events.
1537	A 59-year-old man was admitted to this hospital because of fever, confusion, rash, thrombocytopenia, and renal failure, 10 days after a hunting trip in the Nevada valley. Diagnostic procedures were performed, and diagnostic test results were received from another hospital.
1538	The authors review the history and motivations behind medical repatriation, the transfer of undocumented patients in need of subacute care to their country of origin. They argue that involuntary medical repatriation violates the ethical duties of health care providers.
1539	A follow-up report on a patient whose HIV infection was treated early, but briefly, 15 years ago reveals a likely explanation for the control of HIV without antiretroviral therapy.
1540	Among 504 patients with psoriatic arthritis treated with apremilast [20 or 30 mg] or placebo twice daily for 24 weeks, clinical responses at 16 weeks were more frequent with apremilast [31% and 40%] than placebo [19%], while ALT elevations occurred in 8% of apremilast- vs 13% of placebo-treated subjects.
1541	Among 100 patients with CLL treated with rituximab and chlorambucil in 6 28-day cycles, the overall response rate was 84% and adverse events were mostly hematologic; there were no serious adverse hepatic events and no mention of ALT elevations.
1542	"48 year old woman with idiopathic PAH and ANA positivity [1:1,280] developed ALT elevations [421 U/L] 5 years after starting bosentan, which resolved on stopping but recurred [ALT 521 U/L] 1 year after starting ambrisentan, resolving on stopping but arising again [ALT ~ 250 U/L],resolving with prednisolone therapy after biopsy showed autoimmune hepatitis."
1543	Among 841 adults with inadequately controlled diabetes treated with injections of albiglutide [weekly] or liraglutide [daily] for 32 weeks, HbA1c levels decreased in both groups and adverse event rates were similar; no mention of ALT elevations or hepatotoxicity.
1544	Among 394 previously treated, noncirrhotic patients with chronic hepatitis C, genotype 1, treated with Viekira Pak [D-O-P/r] with ribavirin vs placebos for 12 weeks, the SVR rates were 96% vs 0%; adverse events more frequent with D-O-P/r were fatigue, weakness, insomnia, pruritus, cough and anemia; ALT elevations above 5 times ULN occurred in 5 patients [1.7%] on therapy, one of whom stopped therapy early vs 3 [3.1%] on placebo; no patient developed clinically apparent liver injury.
1545	Among 638 patients with diabetes inadequately controlled on metformin treated with 2 doses of empagliflozin or placebo for 24 weeks, adverse events with empagliflozin included hypoglycemia [1-2%], urinary tract infections [5-6%] and genital infections [12%]; no mention of ALT elevations or hepatotoxicity.
1546	Review of mechanism of action, clinical efficacy and safety of degarelix for advanced prostate cancer mentions that liver test abnormalities occur, but are usually mild and transient and that ALT elevations above 3 times ULN occurred in less than 1% of treated patients.
1547	Among 1879 patients with rheumatoid arthritis treated with subcutaneous abatacept for an average of 2.2 years in 5 clinical trials, serious adverse events included serious infections [1.8% per year], malignancy [1.3%], autoimmune conditions [1.4%], injection site reactions [1.7%], and 4 cases of tuberculosis, one fatal; ALT elevations occurred in 2.4% of patients, but there were no liver related serious adverse events
1548	Among 20 patients treated with mitotane, a clinical response occurred in 40%, but side effects were frequent and progression free survival only 8 weeks; one patient had persistent ALT elevations above 5 times ULN and one died of multiorgan failure.
1549	Description of the spectrum of skin toxicities of kinase inhibitors including vandetanib used in treatment of medullary thyroid cancer mentions that inhibition of EGFR signaling causes growth arrest and apoptosis in keratinocytes, with subsequent release of cytokines and recruitment of inflammatory cells.
1550	7 cases of severe acute liver injury in US Military personnel taking OxyELITE Pro, ages 23-48 years, 3 women and 4 men, on supplement for 1 week to several years [bilirubin 1.2-32 mg/dL, ALT 176-3348 U/L, Alk P 136 U/L], 2 patients requiring liver transplantation.
1551	"Comparison of imatinib vs bosutinib in 502 adults with CML found higher rates of adverse effects with bosutinib, including diarrhea [70% vs 26%], vomiting [33% vs 16%], ALT elevations [33% vs 9%], ALT elevations ?5 times ULN [19% vs 3%] and fever [19% vs 12%]."
1552	We present a 47-year-old man with acute lymphocytic leukemia with a pericardial friction rub heralding pericardial aspergillosis. The clinical course was complicated by pneumopericardium, likely secondary to a direct connection between the lung parenchyma and the pericardial space. Bronchoalveolar lavage cultures returned positive for methicillin-resistant Staphylococcus aureus and Aspergillus niger. Combination voriconazole and vancomycin resulted in symptomatic improvement within 2 weeks of hospitalization.  
1553	The serotonin syndrome has been described only in rare instances for electroconvulsive therapy combined with an antidepressant medication. We describe a case of serotonin toxicity induced by electroconvulsive therapy in combination with fluoxetine.  
1554	Herein we report the successful incorporation of a lactam as an amide replacement in the design of hepatitis C virus NS5B Site II thiophene carboxylic acid inhibitors. Optimizing potency in a replicon assay and minimizing potential risk for CYP3A4 induction led to the discovery of inhibitor 22a. This lead compound has a favorable pharmacokinetic profile in rats and dogs.  
1555	Cilnidipine is a 4(th) generation dihydropyridine calcium channel blocker approved recently for the treatment of essential hypertension. It is not known to present with ankle edema like amlodipine. Moreover, it has been proposed as an alternative anti-hypertensive for patients with amlodipine-induced edema. We report a case of cilnidipine induced ankle edema.  
1556	Hypertriglyceridemia is a known cause of 2%-7% of cases of acute pancreatitis. Although there are numerous potential causes, the use of atypical antipsychotics has been linked to elevated triglycerides and pancreatitis. Here, we present the case of a 42-year-old male patient with a diagnosis of schizoaffective disorder who presented to our hospital with acute pancreatitis due to hypertriglyceridemia, which was exacerbated after he was started on quetiapine.  
1557	We report 7 HIV-infected children with cryptococcosis. Median age and CD4 counts were 9.3 years and 12 cells/mm, respectively. Two children died early. Of 4 children requiring prolonged amphotericin B and fluconazole at a dosage above 12 mg/kg/d, 3 presented with meningitis and 1 with fever. Immune reconstitution inflammatory syndrome contributed to morbidity through exacerbations at the primary site and elsewhere.  
1558	Two novel compounds, 1 and 7, along with six known compounds (2-6 and 8), were isolated from the edible mushroom Mycoleptodonoides aitchisonii (bunaharitake in Japanese). The structures of the new compounds were determined by the interpretation of spectroscopic data. Compounds 1-4 and 6-8 showed protective activity against endoplasmic reticulum stress-dependent cell death.  
1559	We report a rare and unusual case of invasive Enterobius vermicularis infection in a fallopian tube. The patient was a 23-year-old Malaysian woman who presented with suprapubic pain and vaginal bleeding. A clinical diagnosis of ruptured right ovarian ectopic pregnancy was made. She underwent a laparotomy with a right salpingo-oophorectomy. Histopathological examination of the right fallopian tube showed eggs and adult remnants of E. vermicularis, and the results were confirmed using PCR and DNA sequencing.  
1560	The study included 15 patients with purulent inflammatory diseases of maxillofacial area and 25 patients with facial bone necrosis induced by synthetic drugs. Pro- and anti-inflammatory cytokines levels in saliva and wound fluid were analyzed in two groups. The results proved cytokines to play important role in jaw necrosis induced by drugs containing red phosphorus.  
1561	Phospholipase D enzymes have long been proposed to play multiple cell biological roles in cancer. With the generation of phospholipase D1 (PLD1)-deficient mice and the development of small molecule PLD-specific inhibitors, in vivo roles for PLD1 in cancer are now being defined, both in the tumor cells and in the tumor environment. We review here tools now used to explore in vivo roles for PLD1 in cancer and summarize recent findings regarding functions in angiogenesis and metastasis.  
1562	A series of substituted coumarins1-10 was designed and synthesized as a novel class of 4TCNA analogues. Compound 2a showed excellent antiproliferative activity with mean GI50 values at a micromolar level in a diverse set of human cancer cells (GI50Â =Â 2-30Â ÎĽM) and induced a high apoptosis level in MCF-7 breast cancer cell line. The molecular signature of hsp90 inhibition was assessed by depletion of the ErÎ± hsp90 client protein.  
1563	Mycoplasma californicum is one of several mycoplasmal species associated with bovine mastitis. The complete genome sequence of 793,841Â bp has been determined and annotated for the M.Â californicum ST-6 type strain, providing a resource for the identification of surface antigens and putative pathoadaptive features.  
1564	Increased metaiodobenzylguanidine (MIBG) activity in the kidneys is usually focal and commonly attributed to radioactive urine accumulation in the renal pelvis. Hereby, we present 2 cases of abnormal diffuse MIBG activity in the kidneys caused by compromised renal blood flow. The patterns should be differentiated from physiologic renal MIBG activity, especially when the uptake is relatively symmetric as well as from regional MIBG-avid disease.  
1565	The majority of patients with coeliac disease are undiagnosed, leading to debate about the utility of screening. The heterogeneous clinical presentation, which includes asymptomatic forms, can partially explain the difficulties faced when identifying coeliac disease. Now, Kurppa and colleagues add another element to the debate by strengthening the arguments for general screening. 
1566	Acquired hypothyroidism secondary to iodine deficiency is rarely reported in iodine-replete environments. The case of a 9-year-old patient with severe acquired hypothyroidism due to iodine deficiency is presented. His deficiency occurred because of a restrictive diet used to control eosinophilic esophagitis. Hypothyroidism and iodine deficiency were quickly corrected with a kelp supplement. 
1567	Bipolar radiofrequency (RF) has been used to treat photodamage. Periorbital rhytides are often difficult to treat. In this study bipolar RF was assessed in the 20 subjects, who are in treatment of periorbital rhytides and it was proved that it can successfully treat the periorbital rhytides. 
1568	Corynebacterium striatum is an emerging nosocomial pathogen associated with wound infections, pneumonia and meningitis. It is also a multidrug-resistant pathogen causing high morbidity. This is a report of an unusual case of wound infection in a patient with laryngeal carcinoma. Accurate diagnosis of the infection and prompt management helped in a favourable outcome for the patient. This case highlights the role of C. striatum as an important nosocomial pathogen in immunocompromised patients.  
1569	Among 204 patients with metastatic neuroendocrine tumors treated with lanreotide or placebo every 4 weeks for 96 weeks, progression free survival was prolonged by lanreotide, but the overall rates of adverse events were similar; those more frequent with lanreotide were diarrhea, abdominal pain, cholelithiasis10%], flatulence, nausea, headache and lethargy; one patient developed “liver decompensation” the day after the first injection, but ultimately recovered.
1570	Among 89 patients with Castleman disease treated with siltuximab or placebo [11 mg/kg every 3 weeks], durable tumor and symptomatic responses occurred in 34% vs 0% while side effects included pruritus [42% vs 12%], fatigue [34% vs 38%], edema [32% vs 23%], weight gain [21% vs 0%], abdominal pain, thrombocytopenia; no mention of ALT or hepatotoxicity.
1571	"Among 495 patients with major depression not responding adequately to SSRI therapy who were treated with either vortioxetine or agomelatine for 12 weeks, 1 patient on agomelatine was withdrawn from therapy because of ALT elevations [>3 times ULN], but there were no other ""clinically relevant changes over time or differences between treatment groups"" in clinical laboratory results."
1572	Many insurers participating in the new insurance exchanges are controlling costs by offering plans with narrow provider networks. Proposed regulations would promote network adequacy, but a pro-provider stance may not be inherently pro-consumer or even pro-patient.
1573	The authors suggest that functional testing for activated protein C resistance is cheaper and more clinically relevant than genetic testing to detect a factor V Leiden mutation in identifying persons who are at risk for thromboembolism.
1574	A 39-year-old woman with a history of gestational diabetes was admitted with epigastric pain from acute pancreatitis. She had no history of hyperlipidemia, but multiple blood samples were grossly lipemic, and serum triglyceride levels were markedly increased.
1575	"Among 19,102 patients with stable coronary artery disease without heart failure who were treated with ivabradine or placebo for a median of 28 months, there were no differences in cardiovascular endpoints or mortality, and adverse events were more frequent with ivabradline including bradycardia, atrial fibrillation and ""phosphenes"" seeing light without light actually entering the eye; no mention of ALT elevations or hepatotoxicity."
1576	Among 106 patients with chronic hepatitis C, genotype 1, and HIV coinfection treated with simeprevir [12 weeks] combined with peginterferon and ribavirin [24 or 48 weeks], the overall SVR rate was 74%, rash occurred in 16%, photosensitivity 2%, moderate bilirubin elevations 2%, but no patient had significant ALT elevations or clinically apparent liver injury.
1577	Further follow up on 502 patients with CML treated in a phase 3 clinical trial of bosutinib vs imatinib [Gambacorti-Passerini 2014], found similar 3-4 year survival rates, but with higher rates of ALT elevations [23% vs 4%] and discontinuations for ALT abnormalities [4% vs <1%] with bosutinib.
1578	Among 59 Japanese patients with Lennox-Gastaut syndrome receiving adjunctive rufinamide for partial onset seizures for 12 weeks, none had a serious adverse event or discontinuation for an adverse event; no mention of ALT elevations or hepatotoxicity.
1579	Among 42 pateints with Schnitzler's syndrome followed in 16 centers in France, 29 were treated with anankinra, all of whom had marked improvements on therapy which were maintained during an average follow up of 3 years; side effects included injection site reactions [17%], neutropenia [10%], infections [21: mostly pneumonia, 2 being fatal] and colon cancer [1 case]; no mention of hepatotoxicity or ALT elevations and no discontinuations for liver related complications, 
1580	Among 195 children with HIV infection treated with atazanavir based regimens for 48 weeks, 9% developed bilirubin values above 5.1 mg/dL and 3% had ALT elevations above 2.5 times ULN.
1581	Behcet's disease (BD) is a systemic inflammatory disorder characterised by oral/genital ulcers, ocular lesions, and gastrointestinal, musculoskeletal, neurological and major vessel involvements. Venous manifestations are more common than arterial involvements. In this case report, we present a patient with internal jugular vein thrombosis, which is a very rare complication of BD.  
1582	The electronic cigarette is a subject of lively debate in the literature and the legislative. We will review the updates regarding progress on this issue by analyzing the device, the electronic cigarette composition, legislative issues and medical strategy. All will be analyzed in terms of the benefits, but also the immediate and remote consequences 
1583	The low bioavailability of most flavonoids limits their application as anti-carcinogenic agents in humans. A novel approach of treatment with a mixture of bioactive compounds that share molecular anti-carcinogenic targets may enhance the effect on these targets at low concentrations of individual compound, thereby overcoming the limitations of reduced bioavailability. We therefore investigated whether a combination of three natural products arctigenin (Arc), a novel anti-inflammatory lignan from the seeds of  
1584	Disseminated Herpes Simplex Virus (HSV) may occur in immunosuppressed patients, most commonly causing visceral organ involvement and rarely presenting solely with cutaneous lesions. We report an interesting case of disseminated HSV in a 77-year-old immunocompromised man, presenting as necrotic papules and pustules with no associated systemic involvement.  
1585	Studies have shown that a diet of healthy foods typical of Nordic countries has a beneficial effect on risk factors for Type 2 Diabetes (T2D), such as obesity and low-grade inflammation. However, longitudinal epidemiological studies examining the association between the healthy Nordic diet and T2D are lacking.  
1586	The objective of the present work was to improve the effectiveness of early diagnostics, prophylaxis, and correction of hearing impairment in the patients presenting with congenital primary hypothyroidism (CPH). The results of observation of 73 cases indicate that the late onset of substitution therapy of CPH with levothyroxine has no negative effect on the hearing function. The prevalence of hearing impairment was shown to depend on the etiological variant of CPH.  
1587	For more than half a century, the different properties of dexrazoxane have captured the attention of scientists and clinicians. Presently, dexrazoxane is licensed in many parts of the world for two different indications: prevention of cardiotoxicity from anthracycline-based chemotherapy, and prevention of tissue injuries after extravasation of anthracyclines. This article reviews the historical, preclinical, and clinical background for the use of dexrazoxane for these indications.  
