ID	Abstract
1	19 year old female with Crohn disease developed jaundice with high ALT levels, rash, fever, eosinophilia and lymphadenopathy after 8 weeks of sulfasalazine therapy, resolving within 4 weeks.
2	20 year old woman with Crohn disease developed fever 3 weeks after starting sulfasalazine accompanied by a mixed pattern of serum enzyme elevations without jaundice and had recurrence with a similar anicteric pattern 4 days after restarting.
3	9 year old girl developed arthralgias, fever, splenomegaly and ANA-positivity with normal serum enzymes and no jaundice 9 months after starting hydralazine; symptoms resolved within 1 and serology within 11 months of stopping.
4	Among 40 patients with psoriasis treated with 8-methoxypsoralen and ultraviolet light, 6 had transient elevations in serum aminotransferase levels, but further specifics were not given.
5	31 year old woman on OCCs for 11 years was found to have a large hepatic mass and secondary lesions shown histologically to be hepatocellular carcinoma; no details of follow up given.
6	17 year old male with long standing aplastic anemia treated with oxymetholone developed sudden rupture of right lobe of liver and autopsy revealed multiple hepatic nodules and adenomas.
7	13 year old girl with rheumatoid arthritis developed jaundice 5 months after starting penicillamine with recovery in 3 months; no specifics given; benorylate is an ester of acetylsalicylic acid and acetaminophen.
8	48 year old man with renal insufficiency developed rash, fever and abdominal pain 4-5 weeks after starting allopurinol [bilirubin 1.1 rising to 7.7 mg/dL, ALT 134 U/L, Alk P 1317 U/L, 10% eosinophilia], liver biopsy showing cholangitis and cholestasis, died of multiorgan failure.
9	2 men, ages 72 and 58 years, developed fever, rash and eosinophilia 2 and 4 weeks after starting allopurinol [bilirubin 2.4 and 0.5 mg/dL, AST 510 and 65 U/L, Alk P 198 and 200 U/L], one required prednisone for rash, both recovered.
10	Two brothers with Fanconi’s anemia on long term androgen therapy both developed malignancies, including leukemia, gingival squamous cell cancer, and hepatocellular carcinoma.
11	Literature on the mechanism of action of sex steroid hormones is rev iewed. The effects of estrogen, progesterone, and androgen on RNA metabolism, RNA polymerase activity, the accumulation of specific protei ns, the transcription of specific messenger RNA's and their translation, and genetic transcription in vivo and in vitro are discussed.
12	Analysis of first 100 patients in a registry of liver tumors in women found 40 adenomas, 44 focal nodular hyperplasias, 13 liver cancers and 4 unclassified tumors, mean age 30 years [14-47 years], only 4 were never on OCCs, pregnant or on estrogens [4-156 months]; presenting as hemoperitoneum [26%], pain [32%], mass [19%] or incidental finding [20%].
13	Blood chloroquine concentrations were measured in 5 patients having complications related to this treatment. No significant differences were noted when compared to controls. Further studies are required however before drawing any definite conclusions. The persistence of fairly high residual levels, several months after stopping treatment, is evidence of chloroquine retention in these patients. 
14	Seventeen cases of juvenile laryngeal papillomatosis have been seen and treated with microlaryngoscopy, removal of papillomas, and administering of autogenous vaccine. Holinger's original findings could be confirmed. The operation frequency of 9 patients was significantly reduced, 5 were improved, and 3 unchanged. In no case was an undesirable reaction to the vaccine observed. Electron microscopy showed no virus-like particles in the papilloma but a section of a vulvar wart did show the virus. 
15	The authors studied seven patients with sarcoidosis and tuberculosis: the affections co-existed in 3 cases but were separated by varying intervals of time in the 4 other patients. They discuss the diagnostic, therapeutic, and nosological problems posed by these cases, and review the various hypotheses that have been suggested to explain these associations in relation to the pathogenesis of the sarcoidosis. 
16	44 year old woman with rheumatoid arthritis developed large lymph nodes, hepatomegaly and pulmonary infiltrates after 135 mg of gold injections with eosinophila, but minimal to no elevation in AST, Alk P or bilirubin, slowly resolved and liver biopsy was unrevealing.
17	41 year old woman with rheumatoid arthritis developed jaundice 3 weeks after starting penicillamine [bilirubin 3.3 mg/dL, AST 117 U/L, Alk P 1132 U/L], jaundice resolving within 2 weeks and enzyme elevations within 11 weeks of stopping.
18	50 year old man took an overdose [30 mg] of colchicine and rapidly developed fever, diarrhea, vomiting, dehydration and hypotension with renal failure, acidosis, septicemia, and liver test abnormalities [bilirubin 0.7 rising to 6.6 mg/dL, AST 58 to 333 U/L, Alk P 91 to 667 U/L], but ultimate full recovery; sepsis and hypotension may have contributed to the liver abnormalities.
19	A new procedure for purification of glucose-6-phosphate dehydrogenase resulting in an electrophoretically homogenous preparation made up of 5.10(8) cells (390 mg of protein) is proposed. The enzyme yield is more than 20%. The molecular weights of a subunit and a native enzyme are 55000 and 220000, respectively. The isoelectric point for the protein lies at 4,8. The kinetics of the enzyme thermal inactivation obey the first order equation with the inactivation rate constant of 6.10(-3) min-1. 
20	The in vivo antitumor activities, as measured by inhibition of transplanted P-388 and L-1210 leukemia in mice, have been determined for a series of analogs of anguidine including triacetoxyscirpenol, the three diacetoxyscirpenols, the three monoacetoxyscirpenols, and scirpenetriol. An acetoxy function at position 15 appears to be required for good activity. 
21	A twenty-seven year old man with a two year history of sarcoidosis and systemic manifestations of this disease along with verrucous ulcerative skin lesions is presented. Biopsy specimens of the cutaneous lesions showed typical noncaseating granulomas as well as necrotizing granulomatous inflammation. After other possible etiologies were excluded, prednisone therapy was instituted with prompt resolution of the skin lesions, leaving atrophic scars. 
22	A case of onycholysis secondary to the ingestion of tetracycline hydrochloride is reported. The patient was not photosensitive, and the nails returned to normal after withdrawal of the causative drug. 
23	Elevated histamine concentrations of pathophysiological significance could be determined in plasma of dogs suffering from acute pancreatitis according to Pfeffer. This result was also obtained in dogs treated with aminoguanidine, a very effective diamine oxidase blocker, in addition to the duodenal blind loop preparation. Elevated histamine concentrations were found in nine out of ten dogs. 
24	Review of histology of 9 cases of erythromycin liver injury from Armed Forces Institute of Pathology files; mostly cholestatic or mixed enzyme pattern, all self-limited, [bilirubin 2.1-12 mg/dL, ALT 128-560 U/L, Alk P 2-12 times ULN]; liver histology showed cholestasis and hepatocellular injury.
25	Cell-mediated cytotoxicity of adherent and non-adherent subpopulations of mouse lymph node cells sensitized in vitro on monolayers of syngeneic, methylcholanthrene-induced sarcoma cells was examined by inhibition of 3H-thymidine incorporation. The cell-mediated cytotoxicity of nylon wood-adherent, non-adherent and unfractionated lymph node cells was found to be equally efficient. 
26	The clinical results with cardioplegic solutions and hypothermia during aortic cross-clamping are compared with the clinical results obtained with hypothermia only. To complete the study miocardial biopsies were obtained during aortic cross-clamping in order to evaluate the concentration of ATP and CPK. The obtained data confirm the effectiveness of the myocardial protection. 
27	Two patients are reported with hypersensitivity myocarditis. One, a 71-year-old female, was being treated with methyldopa at the time of her death and the second, a 67-year-old female, was receiving tetracycline for a respiratory tract infection. 
28	During serial subcultures 50 micrograms per ml gentamicin and penicillin (100 U per ml)-streptomycin (100 micrograms per ml) depressed cell growth signficantly 2 weeks after the addition of the antibiotics; gentamicin, but not penicillin-streptomycin, stimulated cell growth before it became inhibitory. Removal of the antibiotics resulted in the cell yield returning to normal. The results show that these antibiotics can be harmful to cells even at concentrations thought to be safe. 
29	Naegleria and Acanthamoeba are ubiquitous, free-living amoebas. Infections with Naegleria are acquired nasally by exposure to water and are characterized by an acute fulminant hemorrhagic necrotizing meningoencephalitis leading to death. Acanthamoeba-infections occur in chronically ill, debilitated individuals. A patchy chronic or subacute granulomatous encephalitis is produced by hematogenous spread of the amoebas. The histological or clinical diagnosis is not difficult. 
30	[Glu(OMe)4]oxytocin (XVI) and [Mpr1, Glu(OMe)4]oxytocin (XVII) bearing a methyl ester group in place of the carboxamide group in position 4 of oxytocin were synthesized by (3 + 6) segment condensation using the S-trityl group for the protection of the cysteine side chains. Analogue XVI exhibited 10.5 U/mg in vitro uterotonic, and 42 U/mg avian vasodepressor, activity, and analogue XVII 21.4 U/mg and 82 U/mg of the respective activities. Both compounds showed no response in the rat pressor assay. 
31	31 year old man developed malignant hyperthermia [106.7 oF] 6 hours after ingesting phencyclidine with coma, seizures and subsequent renal failure requiring a 25 day hospitalization; no mention of ALT levels or liver injury.
32	We reviewed 26 patients with brain stem tumors. None had a pre-treatment tissue diagnosis. Four of the 20 treated patients are alive from 22 months to 12 years later, representing no improvement from a preceding series in the same centre. 
33	It is believed that partial destruction of the hepatic lymph drainage during the operation of hepato-portoenterostomy is probably the cause of postoperative attacks of cholangitis. Experimental evidence is described that appears to show that omentopexy to the porta hepatis will aid hepatic lymph drainage and may thus prevent postoperative cholangitis. 
34	Bacteria induce urinary crystallization of struvite and carbonate-apatite as a by-product of ureolysis by urease. Eradication of infection and/or inhibition of urease with acetohydroxamic acid for 5 to 30 months retarded stone growth and brought about partial or comple dissolution of stones in 9 patients. Long-term chemotherapy with antimicrobial agents that achieve steril urine or acetohydroxamic acid in those patients with recalcitrant infection lessens the risk of recurrent calculogenesis. 
35	"Bicycle ergometry on the ""Elema"" electrical bicycle ergometer was conducted on 6, patients of climacteric age (41 to 55 years) with pain in the region of the heart and ECG changes. The method made it possible to confirm the diagnosis of climacteric cardiopathy in 39 and to reveal climacteric cardiopathy and concurrent ischemic heart disease in 23 patients. It was noted that physical load had a favourable effect on processes of repolarization in the myocardium of patients with climacteric cardiopathy. "
36	On the dogs with a Thiry-Pavlov fistula (an isolated loop of the small intestine) the effect of 30-min acceleration on the absorption of thiamine-bromide, riboflavine, pyridoxine-hydrochloride and ascorbic acid as well as on the gastric juice secretion was studied. It was demonstrated that back-to-forth linear acceleration increased vitamin B1 absorption, decreased vitamins B2 and B6 and ascorbic acid absorption, and altered secretion of gastric juice. 
37	Four women, ages 20, 30, 35 and 68 years, who had repeated episodes of liver injury after sulfonamides with shortening of latency upon reexposure, but no worsening of injury [usually hepatocellula] or slowing of resolution, which ranged from 4-12 weeks.
38	"Histologic description of livers from 30 vineyard sprayers' exposed chronically to high levels of copper, found copper granules in Kupffer cells in all 30, with granulomas, fibrosis [portal], nodular regeneration [""liver function was usually normal""] angiosarcoma, cirrhosis and NCPH, although the rates of these findings were not given."
39	A fluorimetric method for analysis of tranylcypromine from plasma is described. After extraction from plasma tranylcypromine reacts with 1-dimethylamino-naphthaline-5-sulfonic acid chloride (DANS-Cl) in order to form the highly fluorescent DANS-tranylcypromine. After chromatographic separation on silicagel plates quantitation is achieved by in situ fluorescence determination. The recovery of tranylcypromine from plasma is 64% with a coefficient of variance of about +/- 6%. 
40	Domperidone (R 33812) was injected i.v. for the prevention of nausea and vomiting in a total of 395 cytostatic treatment courses in 172 patients. The total dose ranged from 1 to 40 mg and was given in one or several doses. Even after the administration of severely emetic substances, vomiting and nausea were largely prevented in hospitalized patients, but the results were rather poor in ambulatory patients. In all of the cytostatic treatment schedules very favourable results were obtained. 
41	The experiment carried out on 6 volunteers shows a better bioavailability of a 75 mg single oral dose of Persantin (Boehringer) than of the same dose of Curantyl (Germed). The difference is due to the manner in which the dragĂ©es are manufactured: the bioavailability of both preparations was the same when the dragĂ©es were pulverized before oral administration. 
42	Elevated doses of the cytostatic cyclophosphamide (Endoxan) given daily for 6 weeks, resulted in a prolonged course of experimental trichophytosis in guinea-pigs. From this phenomenon, it may be concluded that the short self-healing course of this disease is due to a rapid triggering of immunoreactions. The fractionated treatment with cyclophosphamide at defined intervals (50 mg/kg initially and 30 mg/kg at 4-day intervals) did not result in any effect. 
43	Newly developed carbonic acids with hypoglycaemic properties are presented. Their activity is based on an insulin secretion with unusual biphasic dynamics which is seen both after enteral and parenteral administration. In vitro, the substances described have an inhibitory effect on gluconeogenesis in the liver and lipolysis in adipose tissue. 
44	After vaginal application econazol is absorbed to a high degree. Plasma levels are maintained for a relatively long period. Metabolism occurs in the vagina already. As there are no objections concerning toxicology the fact of absorption is considered positive from the therapeutical view-point because this drug does exert its effect not only in the vaginal cavity but also in the epithelium. It is suggested that vaginal absorption is influenced by cervical mucus. 
45	In particular, the action of N alpha-methyl-histamine has to be considered since its secretory response is approximately 1.5 times greater than that of histamine and its secretion lasted for a longer period of time. After C-5-alkylsubstitution, both 5-methyl-histamine and N alpha,5-dimethyl-histamine showed secretory action comparable to that of histamine; the agonistic activity, however, decreased with increasing chain length. 
46	The interaction between human and bovine serum albumins (HSA and BSA) were studied with two derivatives of benzamide, metoclopramide (PrimpĂ©ran) and sultopride (BarnĂ©til). It was possible to evaluate association constants (K ass.) characterising this interaction by fluorescence probe technique inspite of the very low binding tendency, which can be correlated to pharmacokinetic properties of these drugs. 
47	It has been suggested in the past that milk causes an impaired absorption of tetracycline and this paper describes a study set up to examine any inhibition of absorption of a tetracycline derivative, lymecycline (Tetralysal) with the concurrent intake of milk. The results of the study show no clinical reason for restricting a moderate intake of milk in conjunction with lymecycline therapy. 
48	During the period October 1976 to January 1978, 290 patients were examined for sexually transmitted diseases in three venereal clinics in Khartoum Providence. Clinical and laboratory findings showed that nongonococcal urethritis was the commonest STD in men (35.1%), with gonorrhoea the second commonest (25.9%). Most of the patients with STDs were aged between 20 and 30 years. Of the infected men, 49.3% had acquired their infections from prostitutes. 
49	When guinea pigs were sensitized to tuberculin by exposure to complete Freund's adjuvant the size of the intradermal PPD test was positively correlated to the body weight of the animal. Old Tuberculin showed stimulating effect in a subsequent sensitization to merthiolate (thimerosal). The high frequency of delayed cutaneous allergy to merthiolate in Swedish population is probably explained by sensitization through intradermal testing with tuberculin containing merthiolate as a preservative. 
50	"A 7-year-old boy with previously diagnosed multifocal eosinophilic granuloma displayed signs and symptoms of a cervical radiculopathy. After myelograpic demonstration of extradural compression, corticosteroid and radiation therapy produced rapid and complete resolution of his symptoms. We suggest that more discrete classification of the ""xanthomatoses"" of the neurologic literature may provide the basis for choosing nonsurgical intervention in selected cases. "
51	Peripheral venous blood samples were drawn before and after induction of adjuvant arthritis in rabbits at intervals of 15 days. Using these samples, biochemical parameters were measured, including total protein, albumin, globulin, cholesterol, alkaline phosphatase, glutamic oxaloacetic transaminase and glutamic pyruvic transaminase. The various biochemical tests exhibited an abnormal pattern in adjuvant animals as compared to the normal rabbits. The significance of these findings has been discussed. 
52	The effect of haemorrhagic shock on the simultaneous appearance of enteric micro-organisms in the central lymph and the portal blood was studied in 30 dogs. Irreversible haemorrhagic shock results in portal bacteraemia but the lymph remains sterile. Thoracic duct drainage is harmful and hastens the onset of irreversibility. 
53	Fifteen patients with early syphilis were seen between May 1974 and March 1975. These 15 patients comprised all the cases of early syphilis that were seen in Edinburgh during this period. Three of them were men of whom two were homosexual. Liver function tests in these three gave abnormal results. 
54	Superoxide dismutase and glutathione peroxidase activities have been determined in newborns. Their mean values are approximately the same as in normal adults. In some cases a low content of superoxide dismutase and/or a high (superoxide dismutase/glutathione peroxidase) ratio are associated with hematological symptoms. In addition, a low superoxide dismutase activity is associated with hyperbilirubinemia and is present in two of the three cases showing maximal acetylphenylhdrazine-induced hemoloysis. 
55	A 28-yr-old woman was admitted to hospital after a suicide attempt in which she had taken 5600 mg verapamil. On admission she exhibited bradycardia and pronounced hypotension; ECG revealed AV dissociation which persisted for 7 1/2 h after admission. She was discharged well 36 h later. 
56	3H-Spiroperidol of high specific radioactivity labels dopamine receptors in membranes of bovine caudate nucleus and anterior pituitary. The saturation and kinetic properties of 3H-spiroperidol binding are similar in the two tissues. In both caudate and pituitary 3H-spiroperidol displays very high affinity with a dissociation constant of 0.2-0.3 nM. The relative potencies of numerous dopamine agonists and antagonists in competing for 3H-spiroperidol binding are closely similar in anterior pituitary and caudate. 
57	Aldosterone injected i.m. decreased the release of renomedullary PGEs and the index (urinary Na/K ratio) in conscious normotensive intact and adrenalectomized rats. Coadministration of spironolactone increased the release of PGEs as well as the index (urinary Na/K ratio). The effect of spironolactone was partly inhibited by aspirin injected in a ratio 5:1 (aspirin:spironolactone), and effect which could be reversed by the infusion of a synthetic prostaglandin (PGA2) in a subhypotensive dose. 
58	"A study to assess the evolution of the disease in non-lepromatous group, who have taken no treatment in a six year period 1970-1975, was undertaken. Among the 714 patients who did not take treatment, only 432 cases (60.5%) could be examined. The majority of these patients (425) had single lesions. The study revealed that nearly 74% of these ""N"" patients became self-healed. "
59	Experimental investigations have shown that antiaggregants affect the size rather than the rate of venous thrombosis, while clinical trials with prophylactic acetylsalicylic acid have indicated primarily a reduced incidence of pulmonary embolism. Current experiences with acetylsalicylic acid in combination with dipyridamole or low-dose heparin suggest that the incidence of pathology diagnosed by 125I-fibrinogen and of deep vein thrombosis is equally reduced. 
60	The ability of 8-ethoxycarbonyl-10, 11 dihydro-A-prostaglandin(HR 546) to antagonise smooth muscle contracting effect of prostaglandins E2 and F2alpha on isolated preparations of rat and hamster stomach fundus, guinea pig ileum and gerbil colon has been studied. HR 546 was found to be a potent, non-specific, probably competitive, prostaglandin antagonist on these four smooth muscle preparations. 
61	Radioimmunoassay of 5alpha, 7alpha-dihydroxy-11-keto-tetranor-prosta-1,16-dioic acid, main urinary metabolite of prostaglandin F2alpha (PGF2alpha-MUM), was performed in normal subjects. Twenty-four hours secretion of PGF2alpha-MUM were 29.04 +/- 9.73 microgram in males and 18.22 +/- 5.88 microgram in females on an average. And an oral administration of aspirin resulted in the remarkable decrease of PGF2alpha-MUM in both sexes. 
62	A health examination survey showed that 5.7% of 2322 middle-aged men had a haematocrit value below 40%. Only 1.2% had two consecutive low values. 14 men had no bone marrow haemosiderin and increased their haematocrits following iron therapy. In 13 men with no cause of the anaemia detected there was also a significant increase in haematocrit following therapy. The true prevalence of iron deficiency anaemia in this population may be estimated to about 1%. 
63	A total of 1,847 serum samples obtained from human subjects in various areas of Nigeria (North, East and West) were tested for the presence of rubella haemagglutination inhibition antibodies. The results showed that an average of 68% of the Nigerian population studied possessed rubella antibody. 
64	Physical loading affects the patterns of cholesterol metabolism in patients with obesity. Content of total cholesterol was altered in blood serum after loading depending on its initial level: it was increased if the initial level was low; if the initial content of cholesterol was high physical loading caused a hypocholesterolemic effect. Level of cholesterol esters was often decreased after loading. Physical loading activated lecithin-cholesterol-acyl transferase in blood plasma. 
65	Organ cultures are a suitable in vitro test--object for pretherapeutical testing of cytostatic resistance on carcinomas of the cervix uteri. The decrease of activity of lactic dehydrogenase and isocitric acid dehydrogenase, determined histochemically, can be used to monitor cytostatic effects at the cultivated tumour. In preparing chemotherapy schedules for advanced cervical carcinomas, cytostatic agents provedly ineffective in vitro should be avoided. 
66	The spontaneous contractility of the rat epididymis was recorded in vivo and the effects of cyproterone acetate were studied. At 7 days after cyproterone acetate daily administration the records of the epididymal contractility did not show significant differences from the records obtained in control animals. On the contrary, in animals injected during 11 days the amplitude and frequency of epididymal contractions showed a significant decrease, and this activity completely ceased at 14 days of treatment. 
67	Methylprednisolone is more effective than prednisolone in mediating long-term cytolysis and immediate inhibition of nucleoside uptake in human lymphoblastoid cells. This suggests that methylation of prednisolone makes it more potent by aiding interaction with a cellular target rather than increasing its stability. 
68	In a large, open, multicentre trial, conducted in general practice, 765 patients suffering from agoraphobia or social phobias were treated with clomipramine (Anafranil, Geigy Pharmaceuticals). Four hundred and eight patients completed a twelve-week course of treatment. Of 285 withdrawals, 139 were due to side-effects. Good results were obtained on all measures of phobias in those patients who completed the study, the improvements being of the order of 70-80%, and over 50% of patients being symptom-free. 
