ID	Abstract
1045	Several diseases can be prevented either by primary prevention, such as immunisation or behavioural counselling, or secondary prevention such as screening. The new clinical recommendations include screening of abdominal aortic aneurysm among male smokers and ex-smokers aged between 65 and 75 years and the extension of breast cancer screening by mammography for women aged between 40 and 49 years, as well as screening for diabetes among patients with hypertension or dyslipidemia. 
1046	73 year old woman developed jaundice 3 weeks after addition of metformin to chronic therapy with nateglinide and pioglitazone [bilirubin 6.5 mg/dL, ALT 772 U/L, Alk P 635 U/L], resolving within 7 weeks of stopping: Case 2.
1047	Antilymphocyte antibodies have been widely used in oncology and transplantation and are now being tested in autoimmune diseases. For systemic lupus erythematosus, anti-B-cell antibodies are furthest along in development. This article discusses the B-cell abnormalities found in systemic lupus erythematosus and the clinical and immunologic effects of anti-B-cell therapies. 
1048	Fifty-two untreated patients with late-onset Pompe disease completed questionnaires about their clinical condition and level of handicap at baseline and at 1-year (n = 41) and 2-year follow-ups (n = 40). During this period, declines in functional activities, respiratory function, handicap, and survival were recorded on a group level. This study illustrates the progressiveness of late-onset Pompe disease and indicates the need for close clinical follow-up of both children and adults with this disorder. 
1049	Human Immunodeficiency Virus (HIV)-related pulmonary hypertension is a relatively rare disease that can affect HIV sufferers. This is almost always associated with a poor outcome and death. An 18 month-old girl, probably the youngest on record, was diagnosed to have pulmonary hypertension (PHT) and retrospectively found to have HIV infection. Sildenafil was used to control her PHT and she remains alive even after 2 years. 
1050	The prescribing of hormone replacement therapy can give rise to clinical negligence, just like any other area of medical practice -- keeping up to date, ensuring patients are properly informed and so able to consent, and avoiding prescribing pitfalls are the keys to successful risk management. Ultimately, good practice is defensible practice. 
1051	Guidelines for the treatment and management of depression in primary and secondary care have been available for more than a year. Yet anecdotal evidence suggests their implementation is patchy. Treatment should be tailored to the severity of the depression. Psychological treatments can be used alone or in combination with antidepressants, depending on the illness severity. Prescribers and patients should be aware of the side effects of the drugs. 
1052	One of the hallmarks of modern science is technically controlled experimentation. In this paper, we underline how technical developments over the last 150 years have repeatedly created new horizons in amyloid research. The main focus is on chemical and biophysical analyses of amyloid fibrils in vivo and in vitro. Investigations into mechanistic aspects of fibril formation and possible links with pathogenesis are also discussed. 
1053	In this review we present recent studies on the effects of the protein phosphatase inhibitor microcystin on mammalian cells. Whereas high concentrations of microcystin promote liver cell death induced by ROS signalling without the involvement of typical apoptotic proteins, intermediate doses activate classic apoptotic pathways. Low concentrations however, increase liver cell survival and proliferation, and can cause primary liver cancer. 
1054	2-(4-Fluorophenyl)-3-(4-pyridinyl)-5-substituted pyrroles were prepared and evaluated as anticoccidial agents in both in vitro and in vivo assays. Among the compounds evaluated, the dimethylamine-substituted pyrrole 19a is the most potent inhibitor of Eimeria tenella PKG (cGMP-dependent protein kinase). Further SAR studies on the side chain of the 2-pyrrolidine nitrogen did not enhance in vivo anticoccidial activity. 
1055	49 year old woman developed purpuric rash and eosinophilia after 4 weeks of sulfasalazine therapy accompanied by serum enzyme elevations [ALT 171 U/L, Alk P 115 U/L] but no jaundice, rapidly resolving after stopping.
1056	A review presents an incidence of multiple (second) primary tumors of head and neck region resulted from an exposure to tobacco smoke and ethanol. Further, epidemiology, clinical implications, molecular alterations and an impact of genetic factor are described. Finally, alternative theories of origin of multiple primary tumors are discussed. 
1057	Six new steroid glycosides, linckosides F-K, and a related metabolite were isolated from the Okinawan blue starfish Linckia laevigata as mimics or enhancers of nerve growth factor (NGF). Their structures and stereochemistry were elucidated by spectroscopic methods and chemical derivatization. Structure-activity relationships suggest that both a carbon branch modified by a pentose at the side chain and 2'-O-methylxylopyranose at C-3 of the aglycon are important for neuritogenic activity. 
1058	Among 46 patients with leprosy treated with either ethionamide or prothionamide for 6 months, elevations in AST [35-88 U/L] occurred in 18 [39%], often resolving despite continuing medication, and only one patient developed jaundice [on prothionamide].
1059	Severe, acute exacerbations of chronic obstructive pulmonary disease are a common presentation to emergency departments in the UK. In this group of patients, clinical examination can be unreliable in excluding a pneumothorax. With the increasing role of non-invasive positive pressure ventilation in these cases, we present a case report that highlights the need for an urgent chest X-ray prior to commencement of non-invasive positive pressure ventilation. 
1060	We present, to our knowledge, the first published cases of optic neuritis associated with adalimumab, a medication in the class of anti-tumor necrosis factor-alpha (TNF-alpha) antagonists. Approved in recent years by the FDA, adalimumab (Humira, Abbott Laboratories; Abbott Park, IL) is a recombinant monoclonal antibody that targets and blocks the physiologic effects of TNF. Other TNF antagonists have had associations with optic neuritis and demyelinating events. 
1061	A number of pregnant women suffer from psychiatric disorders that require treatment with psychotropic drugs. A literature review suggests that these medications are relatively safe to use during pregnancy. Abrupt discontinuation of these drugs can have both physiological and psychological ramifications, which include unpleasant physical symptoms and re-emergence of the psychiatric condition. Therefore, it is not good practice to discontinue these medications abruptly upon diagnosis of pregnancy. 
1062	56 year old woman with colon cancer developed confusion followed by coma 5 days after a 24 hour intravenous course of fluorouracil [~2 g] with leucovorin [lactate 13.8 mEq/L, arterial pH 7.35, creatinine 6.4 mg/dL], resolving rapidly with hydration and support, ammonia levels normal when tested at time of recovery.
1063	Retrospective analysis of 44 patients treated with linezolid for more than 7 days 8-185 days found cure in 73%, but adverse reactions in 64%, including 25% requiring ICU care: platelet decreases, anemia, gastrointestinal upset, and 10% with serious adverse events of neuropathy, serotonin syndrome and/or lactic acidosis; recommended prospective monitoring.
1064	Review of safety of statins; 38 cases of acute liver failure attributed to the statins were submitted to MedWatch by end of 1999, which gives an estimated rate of 1 per million person years of use; rate of confirmed ALT elevations >3 times ULN is 0.1% with statins and 0.04% with placebo.
1065	"Retrospective analysis of 6 patients with chronic hepatitis and inflammatory arthritis treated with anti-TNF agents for 3-39 months, none had rise in ALT or viral levels during therapy, but 3 with hepatitis B were also on lamivudine."
1066	18 year old woman developed jaundice 5 months after starting flutamide therapy of acne [bilirubin 13 rising to 32 mg/dL, ALT 4717 U/L, GGT 140 U/L], with progressive hepatic failure, liver transplantation but death in perioperative period due to sepsis.
1067	Among 147 patients with age related macular degeneration treated with varying doses of pegaptanib for 54 weeks, ocular adverse events were common, but usually mild-to-moderate, while nonocular events were uncommon and there was no evidence of systemic toxicity.
1068	Analysis of spontaneous adverse reactions reported to Sicilian registries between 1998 and 2004 found 108 serious reactions to NSAIDs, with disproportional reports of hepatitis from nimesulide [3 cases resulting in liver transplantation].
1069	Retrospective analysis of 75 children treated with maintenance thioguanine after chemotherapy for leukemia identified 10 [13%] with portal hypertension [2 with variceal hemorrhage], biopsy in 5 showed nodular regenerative hyperplasia, persistent splenomegaly and thrombocytopenia in most.
1070	49 year old woman with Madura foot who failed to respond to multiple other antifungals had clinical response to voriconazole, but developed abnormal liver tests with Alk P 616 U/L and ALT ~2-3 times normal, but after 18 months developed abdominal pain with ALT 17 times normal and voriconazole was stopped with prompt fall of enzymes to normal.
1071	Systematic review of efficacy and safety of eszopiclone for treatment of insomnia; in 6 large controlled trials involving ~1550 patients, adverse events were uncommon and mild and there were no laboratory test abnormalities identified or mention of clinically apparent liver injury.
1072	32 patients with aspergillosis given voriconazole for 4-24 weeks; 13 [41%] had abnormalities of liver tests, often in first 4 weeks, two were severe, but other abnormalities resolved even on therapy.
1073	Trial comparing entecavir [n=141] to lamivudine [n=145] for lamivudine resistant chronic hepatitis B; ALT flares [>10 times normal] occurred in <1% of entecavir [initial on treatment flare] vs 11% of lamivudine-recipients.
1074	Letter in response to Ho [2005] describing 61 year old Japanese woman who had a clinical response to gefitinib therapy, but developed serum ALT elevations after 8 weeks of therapy, recurring on rechallenge, but later tolerated gefitinib with minimal ALT elevations when given every 5 days instead of daily.
1075	Review of treatment of insomnia in the elderly; chloral hydrate fell out of favor in the 1970s when it was replaced by the benzodiazepines; problems include gastrointestinal intolerance, rapid tolerance, drug-drug interactions, and fatalities from overdose.
1076	Analysis of reports of liver injury from NSAIDs from France and Spain from 1982-2001; among more than 29,000 liver adverse event reports, only 3 were for nabumetone and no details given.
1077	Sinusoidal obstruction syndrome arises in first 20-30 days after HCT, case fatality rate is 15-20%, frequency ~38%, but frequency varies by risk factors [cyclophosphamide pharmacokinetics, preexisting liver disease, irradiation dose and use of gemtuzumab], no therapy has proven efficacious but defibrotide and repletion of glutathione deserve evaluation.
1078	"Controlled trial of 3 regimens of varenicline vs placebo for 12 weeks in 647 smokers; ""results of clinical laboratory tests...demonstrated no clinically meaningful differences between varenicline and placebo""."
1079	Letter in response to Musch [2006] questioning the link of the liver injury with kava [vs kavain] and the theoretical role of kava-cytochrome P450 interactions in causing hepatotoxicity.
1080	Three cases of autoimmune hepatitis arising after simvastatin or atorvastatin therapy 6, 20 and 20 weeks after starting [bilirubin 11.3, 3.4 and 5.5 mg/dL, ALT 1749, 1170 and 155 U/L, Alk P of 228, 160, and 203 U/L, all being ANA or SMA positive in titers of 1:40 to 1:160], all responding to prednisone/azathioprine, but remaining on long term therapy with azathioprine or mycophenylate alone.
1081	Intravenous fluconazole prophylaxis in low birth weight infants reduced rate of invasive candidiasis from 6.6% [historical controls] to 0%, but increased direct and total hyperbilirubinemia from 9% to 43%, but no difference in average ALT or AST or rate of elevations above 250 U/L.
1082	Analysis of the FDAs Medwatch database revealed 99 reports of SOS in adult and 6 in pediatric patients treated with gemtuzumab ozogamicin; review of clinical trials and observational studied found highest rates of SOS [14-40%] in patients who underwent HCT within 3 months of receiving gemtuzumab or who received concurrent chemotherapy with potentially hepatotoxic agents.
1083	Concise review on use of echinocandins in invasive fungal infections; ALT elevations occur in 11% of patients receiving caspofungin; isolated cases of clinically significant hepatic injury have occurred, “although it is not clear whether they were drug-related.”.
1084	Review stressing the rarity of liver injury from acetaminophen in children, reported largely by hepatology referral centers, but rarely seen in cohort studies of acetaminophen overdoses; recommended using <75 mg/kg/day as a safe dose in children.
1085	Review of clofarabine and nelarabine, both of which were recently approved for use in ALL and T cell leukemia or lymphoma, dose limiting toxicities being hepatic for clofarabine, neurologic for nelarabine.
1086	Prospective trial of 104 elderly patients given amiodarone or radiofrequency ablation for atrial flutter; no mention of hepatic toxicity during an average of 13 months of therapy.
1087	89 year old woman with breast cancer developed fatigue 2 months after starting anastrozole [bilirubin 1.6 mg/dL, ALT 410 U/L, Alk P 231 U/L], resolving within 2 weeks of stopping.
1088	Among 92 patients undergoing resection of colorectal liver metastases, those who received chemotherapy [mostly oxaliplatin and fluorouracil] were more likely to have vascular changes, but had similar rates of steatosis compared to those who did not receive chemotherapy.
1089	Among 2931 spontaneous adverse event reports made to the sponsor of imiglucerase between 1997 and 2004, 852 were considered related [or unknown]; the major category of adverse events were injection site reactions, urticarial and rash, but 34 were designated “hepatobiliary”; no further details provided.
1090	Among 20 patients with nonresectable liver metastases undergoing isolated 60 minute hepatic perfusions with hyperthermia and melphalan, all patients developed hepatic injury, which was severe in 55% and fatal in 15%; degree of hepatotoxicity correlated with higher melphalan perfusate levels but not with tumor response, melphalan dose, body weight or other clinical features.
1091	Clinical description of 28 patients with “chronic” outcome of drug induced liver injury included one case attributed to amoxicillin with jaundice arising 5 days after a 1 day course with severe hypersensitivity; 6 months later, only evidence of chronic injury was an elevated GGT ~1.4 times ULN.
1092	25 year old man taking 220,000 IU of vitamin A daily developed abnormal liver tests [ALT 104 U/L, Alk P 361 U/L, GGT 392 U/L], biopsy showing hypertrophied stellate cells and advanced fibrosis.
1093	63 year old woman developed ALT elevations [peak 213 U/L] while on gefitinib and anastrozole, which decreased when gefitinib was stopped and increased again when it was restarted.
1094	Analysis of PPI related reports to Spanish Pharmacovigilance Database during 2004 found 58 reports of liver injury from omeprazole [n=36], lansoprazole [7], pantoprazole [12], rabeprazole [2] and esomeprazole [1], correlating somewhat with relative number of prescriptions; 82% were taking other medications; most resolved uneventually upon withdrawal.
1095	20 year old man developed asymptomatic rises in serum enzymes 3 months after starting mirtazapine [bilirubin 0.4 mg/dL, ALT 182 U/L, Alk P 131 U/L], resolving within 2 months of stopping.
1096	Review of liver toxicity of nevirapine and efavirenz, ALT elevations >5 times ULN reported in 1-8% of efavirenz compared to 4-16% of nevirapine recipients; no mention of delavirdine or rilpivirine.
1097	Review of relationship of androgen and estrogen use and liver tumors. Hemangiomas occur more commonly in women [5:1] as does focal nodular hyperplasia [8:1] but their link to estrogens is controversial; adenomas are clearly linked to estrogen use and are rare in men; hepatocellular carcinoma is more common in men than women [9:1 in some studies] and estrogens appear to increase the risk slightly with an odds ratio of 2.5 for any use and 5.8 for long term use.
1098	23 year old woman found to have chronic elevations in serum enzymes [ALT 48 to 265 U/L, GGT 28, Alk P 173 U/L] while taking St. John’s wort; results on stopping herbal were not provided.
1099	Among 134 patients undergoing hematopoietic cell transplantation for aplastic anemia treated with cyclophosphamide alone or in combination with ATG, rates of bone marrow recovery and graft-vs-host disease were similar in the two groups, as were side effects of infection; no mention of ALT elevations or hepatotoxicity.
1100	Review of the history, phytochemistry, pharmacology, animal and clinical studies and safety of noni; 4 case reports of hepatotoxicity have been reported, but review by the European Food Safety Authority “concluded that there was no convincing evidence for a causal relationship”.
1101	43 year old woman developed fever 2 weeks after starting clozapine, eventually with abdominal pain, [bilirubin 0.6 mg/dL, ALT 246 U/L, Alk P 132 U/L, eosinophilia], worsening on continuing clozapine with pleural effusion and ascites, resolving with stopping drug.
1102	Among 226 pre- and 241 post-transplant patients with chronic hepatitis B treated with adefovir for up to 2 years, ALT elevations occurred in 2-4%; none considered serious or requiring drug discontinuation.
1103	35 year old woman physician developed nausea and pruritus followed by jaundice 2 months after starting mefloquine prophylaxis [bilirubin 7.1 mg/dL, ALT 2411 U/L, Alk P 614 U/L], resolving 5 weeks after stopping: Case 1 in mefloquine.
1104	17 year old woman with CML developed jaundice 1.5 years after starting imatinib [bilirubin 4.1 mg/dL, ALT 570 U/L, Alk P 336 U/L, ANA positive], improving on stopping imatinib and worsening again on restarting 3 weeks later, and then persisting for several months despite stopping, responding ultimately to prednisolone therapy.
1105	63 year old man developed fever and abdominal pain 4 weeks after starting clopidogrel [bilirubin 1.0 mg/dL, ALT 204, Alk P 682 U/L, eosinophils 3037/µL], resolving upon stopping clopidogrel.
1106	51 year old woman developed jaundice 12 weeks after starting labetalol [bilirubin 7.0 mg/dL, ALT 1102 U/L], worsening despite stopping hydrochlorothiazide [bilirubin 24 mg/dL, ALT 4026 U/L, INR 2.0], progressing to liver failure and need for transplantation.
1107	33 year old woman developed jaundice 7 weeks after starting minocycline for acne [bilirubin 9.9 mg/dL, ALT 882 U/L, Alk P 191 U/L, ANA positivity], with subsequent worsening despite stopping drug, ultimately requiring liver transplantation; graft showed massive necrosis.
1108	57 year old male HBsAg carrier who developed severe acute hepatitis after 12 weeks of terbinafine therapy [bilirubin 11.0 mg/dL, ALT 1044 U/L, Alk P 167 U/L] and rise in HBV DNA; suggestive of HBV reactivation rather than terbinafine hepatotoxicity per se.
1109	Among 18 patients with gestational trophoblastic cancer, hepatotoxicity arose after 17 of 74 cycles [23%] of chemotherapy using etoposide, cisplatin, methotrexate and dactinomycin, but most instances were mild and the timing, clinical features and source of the injury were not provided.
1110	Among 309 patients with advanced small cell lung cancer treated with either oral or intravenous topotecan, nonhematologic toxicities included diarrhea, fatigue, dyspnea, anorexia and nausea; no mention of ALT elevations or hepatotoxicity.
1111	Prospective study of 97 patients starting nevirapine-based antiretroviral therapy in Uganda followed for 1-20 months; ALT elevations occurred in 22% and were >5 times ULN in 2.2%, one dying of acute liver failure at week 12 [4 weeks after onset].
1112	Among 103 patients with metastatic or recurrent head and neck cancer treated with cetuximab, adverse events included rash, acne and fatigue, and there were 6 infusion related reactions, including one death; no mention of ALT elevations or hepatotoxicity.
1113	Among 1021 adult patients with colorectal adenomas treated with folic acid [1 mg daily] vs placebo with or without aspirin for up to 8 years, the rate of recurrent adenomas was not reduced with either folate or aspirin; no mention of ALT elevations or hepatotoxicity.
1114	"Controlled trial of two formulations of rFSH in 97 women undergoing ovarian stimulation found similar rates of efficacy and side effects; there were minor changes in ALT and Alk P levels, ""but these changes were within reference ranges and not clinically significant""."
1115	Among 1735 adults with HIV infection started on antiretroviral therapy, 3% developed hyperlactatemia; 23 [1%] with lactic acidosis [22 women and 22 on stavudine, 1 on didanosine and zidovudine], 30% mortality; 44 had symptomatic hyperlactatemia [37 women, all 44 on stavudine, 3 also with didanosine], able to switch to zidovudine without recurrence, 2 of 3 relapsed on restarting stavudine.
1116	Retrospective analysis on 194 patients; ALT levels were >3 times ULN in 27% often in first month; among 48 receiving quetiapine, 27% had ALT elevations, 23% at 6 months, but they were modest and none had elevations greater than 3 fold.
1117	39 year old woman developed fatigue and then jaundice ~10 weeks after starting amodiaquine prophylaxis for malaria [bilirubin 14 mg/dL, ALT 1475 U/L, Alk P 108 U/L, protime 17%]; underwent successful liver transplant 6 days later, liver showed massive necrosis.
1118	"Systematic review of 29 controlled trials of incretin-based therapies of diabetes [exenatide, liraglutide, sitagliptin and vildagliptin], concluding that they have ""modest efficacy"", but were well tolerated with few side effects that occur more frequently than in controls; no mention of ALT levels or hepatotoxicity."
1119	Prospective analysis of 293 patients with latent tuberculosis undergoing 6 months of isoniazid therapy; 17 [5.8%] developed ALT elevations 3 >times ULN and 4 had symptoms; risk factors for ALT elevations were alcohol [14.6% v 4.2%], HCV RNA positivity [15.5% vs 3.4%] and baseline ALT elevations.
1120	30 year old man developed jaundice after being on risperidone and lithium for 8 years [bilirubin 4.7 mg/dL, ALT 99 U/L, Alk P 267 U/L], resolving with change of risperidone to ziprasidone, but 1 year later developed recurrent jaundice 3 weeks after starting quetiapine, having tolerated olanzapine.
1121	Results of a phase II trial of 4 doses of raltegravir vs efavirenz in 198 patients on background optimized regimen for 48 weeks; ALT and AST elevations were rare and similar in rate in both groups.
1122	Controlled trial of 6 doses of nebivolol [1.25-40 mg daily] vs placebo in 909 hypertensive patients; side effects were self-limited, mild and not more frequent than with placebo; laboratory monitoring done, but no mention of change in ALT levels.
1123	Review of hepatic adverse events due to rosuvastatin without new information; ALT elevations occur at a similar rate during rosuvastatin as with other statins and average ~0.4%; acute liver failure has not been definitely linked to statins, estimated rate being ~1 per million patient years, similar to background rate; authors argue against routine monitoring of liver enzymes during rosuvastatin therapy.
1124	56 year old man developed jaundice one month after starting alfuzosin [bilirubin 7.6 rising to 25 mg/dL, ALT 1088 U/L, Alk P 167 U/L, eosinophils 8%, high IgE levels]; prolonged jaundice resolving 5 months after stopping.
1125	A case of exophthalmos, and ectopic hyperplastic thyroid tissue occurring at the base of the tongue, in the subhyoid area and in the lateral thyroid lobe is presented. The frequent misdiagnosis of ectopic thyroid tissue as a thyroglossal-duct cyst should make the surgeon cautiously evaluate each case individually. Selective use of scintigrams with I131 is helpful in the preoperative diagnosis to prevent inadvertent excision of a patient's only remaining thyroid tissue.
1126	It has been the purpose of this discussion to review critically the physiologic considerations and clinical evidence regarding the use of Tris buffer in the treatment of acid-base disorders. It is concluded that there is little current evidence, theoretical, experimental, or clinical, to support the view that Tris has a significant therapeutic role. Some possible exceptions to this general conclusion are considered.
1127	Among 452 patients with advanced non-small cell lung cancer randomized to receive gemcitabine with either paclitaxel or carboplatin, ALT or AST elevations above 5 times ULN occurred in 0.9% vs 1.2% of patients, but other toxicities were more common with the carboplatin than paclitaxel regimen.
1128	Systematic review concluded that milk thistle had no significant effects on mortality in patients with alcoholic liver disease or chronic hepatitis B or C and was not associated with an increased risk of adverse events.
